id,title,description,link,image_link,condition,availability,price,google_product_category,brand
29,"HẠT GIỐNG CỎ ĐUÔI THỎ - Tặng viên nén nảy mầm","HẠT GIỐNG CỎ ĐUÔI THỎ - Tặng viên nén nảy mầm",https://hatgionglamson.com/san-pham/hat-giong-co-duoi-tho-29.html,/asset/upload/image/hat-giong-co-duoi-tho.jpg?v=20190410,New,"In Stock","30,000 VND",,
28,"HẠT GIỐNG HOA CẨM CHƯỚNG CHÙM MIX - Tặng viên nén nảy mầm","HẠT GIỐNG HOA CẨM CHƯỚNG CHÙM MIX - Tặng viên nén nảy mầm",https://hatgionglamson.com/san-pham/hat-giong-hoa-cam-chuong-chum-mix-28.html,/asset/upload/image/hoa-cam-chuong-chum-2.jpg?v=20190410,New,"In Stock","30,000 VND",,
27,"HẠT GIỐNG CỎ NHUNG NHẬT - Tặng viên nén nảy mầm","HẠT GIỐNG CỎ NHUNG NHẬT - Tặng viên nén nảy mầm",https://hatgionglamson.com/san-pham/hat-giong-co-nhung-nhat-27.html,/asset/upload/image/co-nhung-nhat-11.jpg?v=20190410,New,"In Stock","40,000 VND",,
26,"HẠT GIỐNG BẤT TỬ - Tặng viên nén nảy mầm","HẠT GIỐNG BẤT TỬ - Tặng viên nén nảy mầm",https://hatgionglamson.com/san-pham/hat-giong-bat-tu-26.html,/asset/upload/image/hoa-bat-tu-mau-cam.jpg?v=20190410,New,"In Stock","25,000 VND",,
25,"HẠT GIỐNG HOA CÚC ĐÀI LOAN - Tặng viên nén nảy mầm","HẠT GIỐNG HOA CÚC ĐÀI LOAN - Tặng viên nén nảy mầm",https://hatgionglamson.com/san-pham/hat-giong-hoa-cuc-dai-loan-25.html,/asset/upload/image/hat-giong-hoa-cuc-dai-loan.jpg?v=20190410,New,"In Stock","30,000 VND",,
24,"HẠT GIỐNG CỎ ĐỔI  MÀU - Tặng viên nén nảy mầm","HẠT GIỐNG CỎ ĐỔI  MÀU - Tặng viên nén nảy mầm",https://hatgionglamson.com/san-pham/hat-giong-co-doi-mau-24.html,/asset/upload/image/coi-doi-mau-do.jpg?v=20190410,New,"In Stock","30,000 VND",,
23,"HẠT GIỐNG CÁNH BƯỚM VÀNG LÙN KÉP - Tặng viên nén nảy mầm","HẠT GIỐNG CÁNH BƯỚM VÀNG LÙN KÉP - Tặng viên nén nảy mầm",https://hatgionglamson.com/san-pham/hat-giong-canh-buom-vang-lun-kep-23.html,/asset/upload/image/hat-giong-canh-buom-vang-lun-kep-nhieu-mau.jpg?v=20190410,New,"In Stock","25,000 VND",,
22,"Hạt Giống Hoa Cánh Bướm Vàng - Đơn Cao - Tặng viên nén nảy mầm","Hạt Giống Hoa Cánh Bướm Vàng - Đơn Cao - Tặng viên nén nảy mầm",https://hatgionglamson.com/san-pham/hat-giong-hoa-canh-buom-vang-don-cao-22.html,/asset/upload/image/hat-giong-canh-buom-vang-don-cao-1.jpg?v=20190410,New,"In Stock","25,000 VND",,
21,"Hạt Giống Cây Bắt Mồi Bẫy Kẹp - Tặng viên nén nảy mầm","Hạt Giống Cây Bắt Mồi Bẫy Kẹp - Tặng viên nén nảy mầm",https://hatgionglamson.com/san-pham/hat-giong-cay-bat-moi-bay-kep--21.html,/asset/upload/image/bat-moi-bay-kep-1.jpg?v=20190410,New,"In Stock","60,000 VND",,
20,"Hạt Giống Hoa Ban Tím - Tặng viên nén nảy mầm - 10 hạt","Hạt Giống Hoa Ban Tím - Tặng viên nén nảy mầm - 10 hạt",https://hatgionglamson.com/san-pham/hat-giong-hoa-ban-tim-20.html,/asset/upload/image/hoa_ban_tim.jpg?v=20190410,New,"In Stock","25,000 VND",,
19,"Hạt Giống Hoa Baby Trắng - Tặng viên nén nảy mầm - 0.1 gram","Hạt Giống Hoa Baby Trắng - Tặng viên nén nảy mầm - 0.1 gram",https://hatgionglamson.com/san-pham/hat-giong-hoa-baby-trang-0.1-gram-19.html,/asset/upload/image/Baby-s-Breath-0.jpg?v=20190410,New,"In Stock","30,000 VND",,
18,"Hạt Giống Hoa Ánh Dương - Tặng viên nén nảy mầm - Gói 10 Hạt","Hạt Giống Hoa Ánh Dương - Tặng viên nén nảy mầm - Gói 10 Hạt",https://hatgionglamson.com/san-pham/hat-giong-hoa-anh-duong-goi-10-hat-18.html,/asset/upload/image/hoa_anh_duong_1.jpg?v=20190410,New,"In Stock","30,000 VND",,
17,"Combo 10 - 50 - 100 Viên Nén Kích Thích Nảy Mầm","Combo 10 - 50 - 100 Viên Nén Kích Thích Nảy Mầm",https://hatgionglamson.com/san-pham/combo-10-50-100-vien-nen-kich-thich-nay-mam-17.html,/asset/upload/image/vien-nen-kich-thich-nay-mam.jpg?v=20190410,New,"In Stock","25,000 VND",,
16,"Chế Phẩm Kích Hoa Lan Alpha Omega Thái Lan","Chế Phẩm Kích Hoa Lan Alpha Omega Thái Lan",https://hatgionglamson.com/san-pham/che-pham-kich-hoa-lan-alpha-omega-thai-lan-16.html,/asset/upload/image/che_pham_kich_hoa_lan.png?v=20190410,New,"In Stock","110,000 VND",,
15,"Phân Tan Chậm Nhật Bản SUMIAT","Phân Tan Chậm Nhật Bản SUMIAT",https://hatgionglamson.com/san-pham/phan-tan-cham-nhat-ban-sumiat-15.html,/asset/upload/image/phan_bon_tan_cham.png?v=20190410,New,"In Stock","35,000 VND",,
14,"Sumicoat 16-19-16 PHÂN Bón Rễ Phóng Thích Dinh Dưỡng Có Kiểm Soát","Sumicoat 16-19-16 PHÂN Bón Rễ Phóng Thích Dinh Dưỡng Có Kiểm Soát",https://hatgionglamson.com/san-pham/sumicoat-16-19-16-phan-bon-re-phong-thich-dinh-duong-co-kiem-soat-14.html,/asset/upload/image/phan-bon-sumicoat.jpg?v=20190410,New,"In Stock","40,000 VND",,
13,"Củ Hoa Mẫu Đơn Size lớn- Combo 5 củ - 10 củ","Củ Hoa Mẫu Đơn Size lớn- Combo 5 củ - 10 củ",https://hatgionglamson.com/san-pham/cu-hoa-mau-don-combo-5-cu-10-cu-13.html,/asset/upload/image/cu-giong-hoa-mau-don.png?v=20190410,New,"In Stock","40,000 VND",,
12,"Hạt Giống Hoa Hướng Dương Siêu Bông - Tặng viên nén nảy mầm- Gói 30 Hạt","Hạt Giống Hoa Hướng Dương Siêu Bông - Tặng viên nén nảy mầm- Gói 30 Hạt",https://hatgionglamson.com/san-pham/hat-giong-hoa-huong-duong-sieu-bong-goi-30-hat-12.html,/asset/upload/image/hat-giong-hoa-huong-duong-sieu-bong.jpg?v=20190410,New,"In Stock","30,000 VND",,
11,"Hạt Giống Dưa Lưới Ruột Vàng - Tặng viên nén nảy mầm - Gói 15 Hạt","Hạt Giống Dưa Lưới Ruột Vàng - Tặng viên nén nảy mầm - Gói 15 Hạt",https://hatgionglamson.com/san-pham/hat-giong-dua-luoi-ruot-vang-goi-15-hat-11.html,/asset/upload/image/hat-giong-dua-luoi-ruot-vang.jpg?v=20190410,New,"In Stock","25,000 VND",,
10,"Hạt Giống Việt Quất Đỏ - Tặng viên nén nảy mầm - Gói 0,01 Gram ~ 30 Hạt","Hạt Giống Việt Quất Đỏ - Tặng viên nén nảy mầm - Gói 0,01 Gram ~ 30 Hạt",https://hatgionglamson.com/san-pham/hat-giong-viet-quat-do-goi-001-gram-30-hat-10.html,/asset/upload/image/viet-quat-do-1.jpg?v=20190410,New,"In Stock","30,000 VND",,
9,"Hạt Giống Việt Quất Xanh - Tặng viên nén nảy mầm - Gói 0,01 Gram","Hạt Giống Việt Quất Xanh - Tặng viên nén nảy mầm - Gói 0,01 Gram",https://hatgionglamson.com/san-pham/hat-giong-viet-quat-xanh-goi-001-gram-9.html,/asset/upload/image/hat-giong-viet-quat-xanh-4.jpg?v=20190410,New,"In Stock","30,000 VND",,
8,"Hạt Giống Mâm Xôi Đỏ - Tặng kèm viên nén nảy mầm - Gói 0,05 Gram","Hạt Giống Mâm Xôi Đỏ - Tặng kèm viên nén nảy mầm - Gói 0,05 Gram",https://hatgionglamson.com/san-pham/hat-giong-mam-xoi-do-goi-005-gram-8.html,/asset/upload/image/hat-giong-mam-xoi-do1.jpg?v=20190410,New,"In Stock","40,000 VND",,
7,"Hạt Giống Hoa Móng Tay Kép - Tặng kèm viên nén nảy mầm - 50 hạt","Hạt Giống Hoa Móng Tay Kép - Tặng kèm viên nén nảy mầm - 50 hạt",https://hatgionglamson.com/san-pham/hat-giong-hoa-mong-tay-kep-50-hat-7.html,/asset/upload/image/hat-giong-hoa-mong-tay-kep1.jpg?v=20190410,New,"In Stock","30,000 VND",,
6,"Hạt Giống Hoa Dây Leo Xanh - Tặng kèm viên nén nảy mầm - Gói 15- 20 hạt","Hạt Giống Hoa Dây Leo Xanh - Tặng kèm viên nén nảy mầm - Gói 15- 20 hạt",https://hatgionglamson.com/san-pham/hat-giong-hoa-day-leo-xanh-goi-15-20-hat-6.html,/asset/upload/image/hat-giong-day-leo-xanh.jpg?v=20190410,New,"In Stock","25,000 VND",,
5,"Hạt Giống Hoa Xác Pháo Mix Màu - Tặng kèm viên nén nảy mầm - Gói 20 Hạt","Hạt Giống Hoa Xác Pháo Mix Màu - Tặng kèm viên nén nảy mầm - Gói 20 Hạt",https://hatgionglamson.com/san-pham/hat-giong-hoa-xac-phao-mix-mau-goi-20-hat-5.html,/asset/upload/image/hat-giong-hoa-xac-phao.jpg?v=20190410,New,"In Stock","25,000 VND",,
4,"Hạt Giống Hoa Thược Dược Đỏ  - Tặng kèm viên nén nảy mầm - Gói 50 Hạt","Hạt Giống Hoa Thược Dược Đỏ  - Tặng kèm viên nén nảy mầm - Gói 50 Hạt",https://hatgionglamson.com/san-pham/hat-giong-hoa-thuoc-duoc-do-goi-50-hat-4.html,/asset/upload/image/hat-giong-hoa-thuoc-duoc-do.jpg?v=20190410,New,"In Stock","30,000 VND",,
3,"Hạt Giống Sen Đài Loan Cánh Kép  - Tặng kèm viên nén nảy mầm - 12 Hạt","Hạt Giống Sen Đài Loan Cánh Kép  - Tặng kèm viên nén nảy mầm - 12 Hạt",https://hatgionglamson.com/san-pham/hat-giong-sen-dai-loan-canh-kep-12-hat-3.html,/asset/upload/image/hat-giong-sen-dai-loan-canh-kep.jpg?v=20190410,New,"In Stock","50,000 VND",,
2,"Củ Giống Hoa Ly SIZE LỚN- Tặng kèm viên nén nảy mầm","Củ Giống Hoa Ly SIZE LỚN- Tặng kèm viên nén nảy mầm",https://hatgionglamson.com/san-pham/cu-giong-hoa-ly-2.html,/asset/upload/image/cu-giong-hoa-ly1.jpg?v=20190410,New,"In Stock","40,000 VND",,
1,"Hạt Giống Cúc Vạn Thọ F1 Vàng Cam - Tặng kèm viên nén nảy mầm","Hạt Giống Cúc Vạn Thọ F1 Vàng Cam - Tặng kèm viên nén nảy mầm",https://hatgionglamson.com/san-pham/hat-giong-cuc-van-tho-f1-vang-cam-1.html,/asset/upload/image/hat_giong_van_tho_f1.png?v=20190410,New,"In Stock","30,000 VND",,
salepage_85,"Lác Mắt Với Giống Cà Chua Dâu Tây TomatoBerry - Chuỗi Chi Chít Quả, Vị Khác Lạ, Hái Mỏi Tay Chỉ Sau 90 Ngày Trồng","Lác Mắt Với Giống Cà Chua Dâu Tây TomatoBerry - Chuỗi Chi Chít Quả, Vị Khác Lạ, Hái Mỏi Tay Chỉ Sau 90 Ngày Trồng",https://hatgionglamson.com/ca-chua-dau-tay.htm,,New,"In Stock",,,
salepage_84,"Choáng Ngợp Với Hơn 32.000 Quả Trên Cùng Một Thân Cây - Giống Cà Chua Bạch Tuộc Leo Giàn Sai Quả Nhất Thế Giới","Choáng Ngợp Với Hơn 32.000 Quả Trên Cùng Một Thân Cây - Giống Cà Chua Bạch Tuộc Leo Giàn Sai Quả Nhất Thế Giới",https://hatgionglamson.com/90-ngay-thu-hoach-voi-hon-32.000-qua-tren-cung-mot-than-cay-ca-chua-bach-tuoc-giu-ky-luc-guinness-tren-the-gioi.htm,,New,"In Stock",,,
salepage_83,"Giải Pháp Mới Cho Người Bận Rộn: Trồng Sen Mini Thủy Canh 7 Màu Ít Thay Nước, 3 Tháng Nở Hoa Thơm Ngát","Giải Pháp Mới Cho Người Bận Rộn: Trồng Sen Mini Thủy Canh 7 Màu Ít Thay Nước, 3 Tháng Nở Hoa Thơm Ngát",https://hatgionglamson.com/su-that-ve-giong-sen-mini-thuy-canh-3-thang-no-hoa.htm,,New,"In Stock",,,
salepage_82,"Thu Hoạch Mỏi Tay Với 20 Giống Cây Ăn Quả Dễ Trồng Nhanh Thu Hoạch, Năng Suất Cao - Thích Hợp Trồng Chậu Hoặc Vườn Nhà Phố","Thu Hoạch Mỏi Tay Với 20 Giống Cây Ăn Quả Dễ Trồng Nhanh Thu Hoạch, Năng Suất Cao - Thích Hợp Trồng Chậu Hoặc Vườn Nhà Phố",https://hatgionglamson.com/mo-hinh-trong-kinh-te-mang-lai-thu-nhap-cao-voi-20-giong-cay-trong-moi-nhanh-thu-hoach-nang-suat-cao.htm,,New,"In Stock",,,
salepage_81,"Thấy Là Thèm, Ăn Là Ghiền Với Giống Chanh Leo Vàng Nhật Bản 7 Ngọt 3 Chua - Món Ăn Khoái Khẩu Của Chị Em Phụ Nữ","Thấy Là Thèm, Ăn Là Ghiền Với Giống Chanh Leo Vàng Nhật Bản 7 Ngọt 3 Chua - Món Ăn Khoái Khẩu Của Chị Em Phụ Nữ",https://hatgionglamson.com/thay-la-them-an-la-ghien-voi-giong-chanh-leo-vang-nhat-ban-7-ngot-3-chua-mon-an-khoai-khau-cua-chi-em-phu-nu.htm,,New,"In Stock",,,
salepage_80,"Rước May Mắn Tài Lộc Vào Nhà Với Bộ Ba Giống Chuối Cảnh Thái Lan Tuyệt Đẹp - Thích Hợp Trồng Chậu, Thùng Xốp Tại Nhà","Rước May Mắn Tài Lộc Vào Nhà Với Bộ Ba Giống Chuối Cảnh Thái Lan Tuyệt Đẹp - Thích Hợp Trồng Chậu, Thùng Xốp Tại Nhà",https://hatgionglamson.com/giong-chuoi-canh-thai-lan-trong-chau.htm,,New,"In Stock",,,
salepage_79,"Tác Hại Của Việc Sử Dụng Tinh Dầu Thơm Giả Ảnh Hưởng Nghiêm Trọng Đến Sức Khỏe Của Con Người","Tác Hại Của Việc Sử Dụng Tinh Dầu Thơm Giả Ảnh Hưởng Nghiêm Trọng Đến Sức Khỏe Của Con Người",https://hatgionglamson.com/tac-hai-cua-viec-su-dung-tinh-dau-thom-gia.htm,,New,"In Stock",,,
salepage_78,"13 Giống Cây Ăn Quả Trồng Chậu, Nhanh Thu Hoạch, Năng Suất Cao, Thích Hợp Với Khí Hậu Việt Nam","13 Giống Cây Ăn Quả Trồng Chậu, Nhanh Thu Hoạch, Năng Suất Cao, Thích Hợp Với Khí Hậu Việt Nam",https://hatgionglamson.com/13-giong-cay-an-qua-trong-chau-nhanh-thu-hoach-nang-suat-cao-thich-hop-voi-khi-hau-viet-nam.htm,,New,"In Stock",,,
salepage_77,"Nhân Giống Hiệu Quả Với Bộ Dụng Cụ Cắt, Ghép, Chiết Cành Tiện Lợi Siêu Bền - Giải Pháp Tối Ưu Cho Người Làm Vườn","Nhân Giống Hiệu Quả Với Bộ Dụng Cụ Cắt, Ghép, Chiết Cành Tiện Lợi Siêu Bền - Giải Pháp Tối Ưu Cho Người Làm Vườn",https://hatgionglamson.com/nhan-giong-hieu-qua-voi-bo-dung-cu-cat-ghep-chiet-canh-giai-phap-toi-uu-cho-nguoi-lam-vuon.htm,,New,"In Stock",,,
salepage_76,"THÊM HÌNH CHẠY SHOPPING","THÊM HÌNH CHẠY SHOPPING",https://hatgionglamson.com/them-hinh-chay-shopping.htm,,New,"In Stock",,,
salepage_73,"Top 3 Hạt Giống Mini Giúp Khu Vườn Tỏa Sáng, Chỉ Việc Ngồi Đợi Thu Hoạch Mỏi Tay","Top 3 Hạt Giống Mini Giúp Khu Vườn Tỏa Sáng, Chỉ Việc Ngồi Đợi Thu Hoạch Mỏi Tay",https://hatgionglamson.com/top-3-hat-giong-mini-giup-khu-vuon-toa-sang-chi-viec-ngoi-doi-thu-hoach-moi-tay.htm,,New,"In Stock",,,
salepage_71,"Có Ngay Một Khu Vườn Mini Quanh Năm Chỉ Với Top 3 Bộ Hạt Giống Dễ Trồng, Thu Hoạch Liền Tay","Có Ngay Một Khu Vườn Mini Quanh Năm Chỉ Với Top 3 Bộ Hạt Giống Dễ Trồng, Thu Hoạch Liền Tay",https://hatgionglamson.com/co-ngay-mot-khu-vuon-mini-quanh-nam-chi-voi-top-3-bo-hat-giong-de-trong-thu-hoach-lien-tay.htm,,New,"In Stock",,,
salepage_69,"Phát Sốt Với Hơn 150 Quả Bắp Cải Tí Hon Trên Cùng 1 Thân Cây - Hái Mỏi Tay, Ăn Quài Không Hết","Phát Sốt Với Hơn 150 Quả Bắp Cải Tí Hon Trên Cùng 1 Thân Cây - Hái Mỏi Tay, Ăn Quài Không Hết",https://hatgionglamson.com/bap-cai-ti-hon.htm,,New,"In Stock",,,
salepage_68,"Lạ Mắt Với Giống Nho Tím Bonsai Khổng Lồ Akebi Nhật Bản Ngọt Lịm Mới Lạ - Ăn 1 Lần Xuyến Xao Cả Đời ","Lạ Mắt Với Giống Nho Tím Bonsai Khổng Lồ Akebi Nhật Bản Ngọt Lịm Mới Lạ - Ăn 1 Lần Xuyến Xao Cả Đời ",https://hatgionglamson.com/bat-mi-bi-mat-ve-giong-nho-akibe-nhat-ban-khong-lo-an-1-lan-xao-xuyen-ca-doi.htm,,New,"In Stock",,,
salepage_65,"Đẹp Đến Lạ Thường Với Giống Hoa Bắp Cải Nhiều Màu - Lên Đời Cây Cảnh Chơi Tết","Đẹp Đến Lạ Thường Với Giống Hoa Bắp Cải Nhiều Màu - Lên Đời Cây Cảnh Chơi Tết",https://hatgionglamson.com/giong-hoa-bap-cai-nhieu-mau.htm,,New,"In Stock",,,
salepage_62,"Top 5 Loài Hoa Đẹp Đáng Trồng Để Rước May Mắn, Tài Lộc Vào Nhà","Top 5 Loài Hoa Đẹp Đáng Trồng Để Rước May Mắn, Tài Lộc Vào Nhà",https://hatgionglamson.com/5-loai-hoa-dep-dang-trong-de-ruoc-may-man-tai-loc-vao-nha.htm,,New,"In Stock",,,
salepage_61,"Yêu Ngay Từ Cái Nhìn Đầu Tiên: Giống Hoa Hướng Dương Lùn Chỉ 20 ~ 40 cm - Thích Hợp Trồng Chậu Nhỏ Để Bàn, Chơi Tết","Yêu Ngay Từ Cái Nhìn Đầu Tiên: Giống Hoa Hướng Dương Lùn Chỉ 20 ~ 40 cm - Thích Hợp Trồng Chậu Nhỏ Để Bàn, Chơi Tết",https://hatgionglamson.com/sung-sot-voi-giong-hoa-huong-duong-lun-chi-20-40-cm-thich-hop-trong-chau-canh-phong-thuy-trong-nha.htm,,New,"In Stock",,,
salepage_59,"Sốt Xình Xịch Với Giống Mai Đỏ Nhật Bản Ra Hoa Chi Chít, Tạo Dáng Bonsai Siêu Đẹp, Đem Lại Sung Túc Vào Ngày Tết","Sốt Xình Xịch Với Giống Mai Đỏ Nhật Bản Ra Hoa Chi Chít, Tạo Dáng Bonsai Siêu Đẹp, Đem Lại Sung Túc Vào Ngày Tết",https://hatgionglamson.com/giong-mai-do-nhat-ban.htm,,New,"In Stock",,,
salepage_58,"Trồng Cây Ăn Trái Siêu Lùn Độc Đáo Trên Sân Thượng: Nhìn Mướt Mắt, Hái Liền Tay","Trồng Cây Ăn Trái Siêu Lùn Độc Đáo Trên Sân Thượng: Nhìn Mướt Mắt, Hái Liền Tay",https://hatgionglamson.com/trong-cay-an-trai-sieu-lun-doc-dao-tren-san-thuong-nhin-muot-mat-hai-lien-tay.htm,,New,"In Stock",,,
salepage_57,"Nhanh Tay Trồng Giống Cà Chua Amur Tiger Lạ Mắt, Trái To, Vị Ngọt Gấp 3 Lần Cà Chua Thường Sau 100 Ngày","Nhanh Tay Trồng Giống Cà Chua Amur Tiger Lạ Mắt, Trái To, Vị Ngọt Gấp 3 Lần Cà Chua Thường Sau 100 Ngày",https://hatgionglamson.com/nhanh-tay-trong-giong-ca-chua-amur-tiger-la-mat-trai-to-vi-ngot-gap-3-lan-ca-chua-thuong-sau-100-ngay.htm,,New,"In Stock",,,
salepage_52,"Chi Chít Quả Sau 2 Năm Gieo Trồng -  Giống Mới Thanh Long Vàng Trồng Chậu: Trồng Chơi Ăn Thật","Chi Chít Quả Sau 2 Năm Gieo Trồng -  Giống Mới Thanh Long Vàng Trồng Chậu: Trồng Chơi Ăn Thật",https://hatgionglamson.com/giong-thanh-long-vang-malaysia.htm,,New,"In Stock",,,
salepage_51,"Phấn Khích Với Táo Đỏ Ruột Đỏ (Redlove) – Giống Táo Duy Nhất Trên Thế Giới Có Ruột Đỏ Vỏ Đỏ Siêu Trái, Trồng Vườn, Trồng Chậu Đều Bội Thu ","Phấn Khích Với Táo Đỏ Ruột Đỏ (Redlove) – Giống Táo Duy Nhất Trên Thế Giới Có Ruột Đỏ Vỏ Đỏ Siêu Trái, Trồng Vườn, Trồng Chậu Đều Bội Thu ",https://hatgionglamson.com/phan-khich-voi-tao-do-ruot-do-redlove-giong-tao-duy-nhat-tren-the-gioi-sieu-trai-trong-vuon-trong-chau-deu-boi-thu.htm,,New,"In Stock",,,
salepage_50,"Tròn Mắt Với Giống Dâu Tây Leo Giàn Cao Đến 3m Mới Xuất Hiện Mà Mọi Nhà Đều Có Thể Trồng Và Thu Hoạch Sau 90 Ngày","Tròn Mắt Với Giống Dâu Tây Leo Giàn Cao Đến 3m Mới Xuất Hiện Mà Mọi Nhà Đều Có Thể Trồng Và Thu Hoạch Sau 90 Ngày",https://hatgionglamson.com/phat-cuong-voi-giong-dau-tay-leo-gian-thu-hoach-chi-sau-90-ngay-trong-tuoi-tho-len-den-10-nam.htm,,New,"In Stock",,,
salepage_49,"Giống Đu Đủ Vàng Lùn Cao Sản F1 Thái Lan Sai Trĩu Quả - Trồng Kinh Tế Hoặc Chậu Làm Cảnh Thu Nhập Hàng Trăm Triệu Đồng Mỗi Năm","Giống Đu Đủ Vàng Lùn Cao Sản F1 Thái Lan Sai Trĩu Quả - Trồng Kinh Tế Hoặc Chậu Làm Cảnh Thu Nhập Hàng Trăm Triệu Đồng Mỗi Năm",https://hatgionglamson.com/du-du-vang-lun-canh-tim-cao-san-thai-lan.htm,,New,"In Stock",,,
salepage_48,"Giống Đu Đủ Lùn Xanh Cao Sản Trồng Chậu, Bonsai Cực Thích Mắt - Tận Hưởng Thành Công Sau 7 Tháng","Giống Đu Đủ Lùn Xanh Cao Sản Trồng Chậu, Bonsai Cực Thích Mắt - Tận Hưởng Thành Công Sau 7 Tháng",https://hatgionglamson.com/giong-du-du-bonsai-trong-chau-cuc-thich-mat-bat-ky-ai-cung-co-the-trong-thanh-cong-sau-7-thang.htm,,New,"In Stock",,,
salepage_47,"Điên Loạn Với Giống Chuối Mini - Cây Cảnh Phong Thủy Dẫn Đầu Xu Hướng Nội Thất Ngày Nay","Điên Loạn Với Giống Chuối Mini - Cây Cảnh Phong Thủy Dẫn Đầu Xu Hướng Nội Thất Ngày Nay",https://hatgionglamson.com/dien-loan-voi-giong-chuoi-mini-cay-phong-thuy-dan-dau-xu-huong-noi-that-ngay-nay.htm,,New,"In Stock",,,
salepage_46,"Lọ Hoa Bất Tử Có Hương Thơm Mới Lạ - Đẹp Đến Xiêu Lòng ","Lọ Hoa Bất Tử Có Hương Thơm Mới Lạ - Đẹp Đến Xiêu Lòng ",https://hatgionglamson.com/lo-hoa-bat-tu-co-huong-thom-moi-la-dep-den-xieu-long.htm,,New,"In Stock",,,
salepage_44,"Toàn Bộ Kỹ Thuật Trồng Dâu Tây Chịu Nhiệt Nhật Bản Tại Nhà Thành Công 100%","Toàn Bộ Kỹ Thuật Trồng Dâu Tây Chịu Nhiệt Nhật Bản Tại Nhà Thành Công 100%",https://hatgionglamson.com/toan-bo-ky-thuat-trong-dau-tay-chiu-nhiet-nhat-ban-tai-nha-thanh-cong-100.htm,,New,"In Stock",,,
salepage_43,"Cuốn Hút Từ Cái Nhìn Đầu Tiên - Giống Mới Táo Đỏ Lùn F1 Siêu Ngọt Trồng Chậu, Tạo Dáng Bonsai: Trồng Chơi Ăn Thật ","Cuốn Hút Từ Cái Nhìn Đầu Tiên - Giống Mới Táo Đỏ Lùn F1 Siêu Ngọt Trồng Chậu, Tạo Dáng Bonsai: Trồng Chơi Ăn Thật ",https://hatgionglamson.com/giong-tao-do-lun-f1-sieu-ngot-trong-trong-chau-tao-dang-bonsai-lam-choi-an-that.htm,,New,"In Stock",,,
salepage_42,"Trồng Cà Chua Thân Gỗ, Giá 1 Triệu Đồng/Kg, Thu Hoạch Trái Sau 16 Tháng","Trồng Cà Chua Thân Gỗ, Giá 1 Triệu Đồng/Kg, Thu Hoạch Trái Sau 16 Tháng",https://hatgionglamson.com/trong-ca-chua-than-go-gia-1-trieu-dong-kg-thu-hoach-trai-sau-16-thang.htm,,New,"In Stock",,,
salepage_39,"Khám Phá Giống Dâu Tây Chịu Nhiệt Tochiotome Trồng Chậu Hoặc Giỏ Treo - Thích Hợp Với Những Vùng Khí Hậu Nóng Bức","Khám Phá Giống Dâu Tây Chịu Nhiệt Tochiotome Trồng Chậu Hoặc Giỏ Treo - Thích Hợp Với Những Vùng Khí Hậu Nóng Bức",https://hatgionglamson.com/giong-dau-tay-chiu-nhiet-tochiotome.htm,,New,"In Stock",,,
salepage_37,"Phát Sốt Với Giống Chuối Đỏ Dacca - Dinh Dưỡng Cao Gấp 2, Độc Lạ Với Màu Đỏ Tím Bắt Mắt","Phát Sốt Với Giống Chuối Đỏ Dacca - Dinh Dưỡng Cao Gấp 2, Độc Lạ Với Màu Đỏ Tím Bắt Mắt",https://hatgionglamson.com/su-that-ve-chuoi-do-dacca-600.000-dong-kg-tai-viet-nam.htm,,New,"In Stock",,,
salepage_35,"GIỐNG DƯA PEPINO NAM MỸ CAO SẢN - NGUỒN LỢI KINH TẾ MỚI CHO NHÀ NÔNG  ","GIỐNG DƯA PEPINO NAM MỸ CAO SẢN - NGUỒN LỢI KINH TẾ MỚI CHO NHÀ NÔNG  ",https://hatgionglamson.com/dua-pepino-f1-nguon-loi-kinh-te-moi-cho-nha-nong.htm,,New,"In Stock",,,
salepage_33,"TẤT TẦN TÂN MÔ HÌNH CÀ CHUA CHERRY SIÊU NGỌT THỦY CANH TẠI NHÀ ","TẤT TẦN TÂN MÔ HÌNH CÀ CHUA CHERRY SIÊU NGỌT THỦY CANH TẠI NHÀ ",https://hatgionglamson.com/tat-tan-tan-mo-hinh-ca-chua-cherry-sieu-ngot-thuy-canh-tai-nha.htm,,New,"In Stock",,,
salepage_30,"Hơn 32.000 Quả Trên Một Thân Cây - Giống Cà Chua Bạch Tuộc Leo Giàn Sai Quả Nhất Thế Giới","Hơn 32.000 Quả Trên Một Thân Cây - Giống Cà Chua Bạch Tuộc Leo Giàn Sai Quả Nhất Thế Giới",https://hatgionglamson.com/ca-chua-leo-gian-ca-chua-bach-tuoc-ky-la-32000-qua-chen-nhau-tren-mot-than-cay.htm,,New,"In Stock",,,
salepage_29,"Dưa Sừng Vàng: Dưa Gai Độc Lạ, giá 1,6 Triệu Đồng/Ký Hiếm Có Khó Tìm","Dưa Sừng Vàng: Dưa Gai Độc Lạ, giá 1,6 Triệu Đồng/Ký Hiếm Có Khó Tìm",https://hatgionglamson.com/dua-sung-vang-dua-gai-doc-la-gia-16-trieu-dong-ky-hiem-co-kho-tim.htm,,New,"In Stock",,,
salepage_28,"Hồng Leo Pháp Đẹp Ngất Ngây - Trồng Chậu, Ban Công Hoặc Sân Thượng Tỏa Hương Thơm Ngát","Hồng Leo Pháp Đẹp Ngất Ngây - Trồng Chậu, Ban Công Hoặc Sân Thượng Tỏa Hương Thơm Ngát",https://hatgionglamson.com/cach-trong-hoa-hong-leo-phap-dep-ngat-ngay.htm,,New,"In Stock",,,
salepage_27,"Tự Trồng Hướng Dương Khổng Lồ Siêu Hạt Ngay Tại Nhà - Ăn Thả Ga Sau 3 Tháng Trồng","Tự Trồng Hướng Dương Khổng Lồ Siêu Hạt Ngay Tại Nhà - Ăn Thả Ga Sau 3 Tháng Trồng",https://hatgionglamson.com/tu-trong-huong-duong-khong-lo-sieu-hat-ngay-tai-nha-an-tha-ga-sau-3-thang-trong.htm,,New,"In Stock",,,
salepage_26,"1 Năm Thu Hoạch – Giống Nho Lùn Pháp Siêu Năng Suất, Siêu Lùn Trồng Chậu,Tạo Dáng Bonsai Lúc Lỉu Quả","1 Năm Thu Hoạch – Giống Nho Lùn Pháp Siêu Năng Suất, Siêu Lùn Trồng Chậu,Tạo Dáng Bonsai Lúc Lỉu Quả",https://hatgionglamson.com/1-nam-thu-hoach-nho-lun-phap-sieu-nang-suat-sieu-lun-trong-canh-luc-liu-qua.htm,,New,"In Stock",,,
salepage_25,"Chao Đảo Trước Vẻ đẹp Lung Linh Của Sen Đá Kim Cương - Cực Dễ Trồng Tại Nhà","Chao Đảo Trước Vẻ đẹp Lung Linh Của Sen Đá Kim Cương - Cực Dễ Trồng Tại Nhà",https://hatgionglamson.com/sen-da-kim-cuong.htm,,New,"In Stock",,,
salepage_22,"Lựu Lùn Ai Cập Cao Sản Ăn Quả Trồng Chậu, Tạo Dáng Bonsai Làm Cảnh - Xu Hướng Mới Nhất Hiện Nay","Lựu Lùn Ai Cập Cao Sản Ăn Quả Trồng Chậu, Tạo Dáng Bonsai Làm Cảnh - Xu Hướng Mới Nhất Hiện Nay",https://hatgionglamson.com/luu-do-dam-lun-f1-cao-san-sieu-trai-trong-canh-va-lam-kinh-te-dem-lai-loi-nhuan-cao.htm,,New,"In Stock",,,
salepage_21,"Cách Trồng Đu Đu Lùn Cao Sản Trong Chậu Làm Cảnh Ngay Tại Nhà","Cách Trồng Đu Đu Lùn Cao Sản Trong Chậu Làm Cảnh Ngay Tại Nhà",https://hatgionglamson.com/cach-trong-du-du-lun-cao-san-trong-chau-lam-canh-ngay-tai-nha.htm,,New,"In Stock",,,
salepage_20,"Nho Thân Gỗ Nghìn Quả - Siêu Năng Suất - Siêu Lợi Nhuận","Nho Thân Gỗ Nghìn Quả - Siêu Năng Suất - Siêu Lợi Nhuận",https://hatgionglamson.com/nho-than-go-nghin-qua-sieu-nang-suat-sieu-loi-nhuan.htm,,New,"In Stock",,,
salepage_19,"Trọn Bộ Vòi Bơm Dinh Dưỡng Tự Động - Hiệu Quả, An Toàn, Tiết Kiệm","Trọn Bộ Vòi Bơm Dinh Dưỡng Tự Động - Hiệu Quả, An Toàn, Tiết Kiệm",https://hatgionglamson.com/bo-voi-bom-dinh-duong-tu-dong-giai-phap-hieu-qua-cho-cay-canh-trong-nha.htm,,New,"In Stock",,,
salepage_17,"Mẹo Nhỏ Trồng Sen Mini Thủy Canh 7 Màu Thơm Ngát Tại Nhà Ai Cũng Làm Được","Mẹo Nhỏ Trồng Sen Mini Thủy Canh 7 Màu Thơm Ngát Tại Nhà Ai Cũng Làm Được",https://hatgionglamson.com/cach-trong-sen-mini-thuy-canh-trong-nha-pho-chat-hep.htm,,New,"In Stock",,,
