id,title,description,link,image_link,condition,availability,price,google_product_category,brand
407,"Hạt Giống Thù Lù Nam Mỹ - Cây Anh Đào Đất - 50 Hạt","Hạt Giống Thù Lù Nam Mỹ - Cây Anh Đào Đất - 50 Hạt",https://hatgionglamson.com/san-pham/hat-giong-thu-lu-nam-my-cay-anh-dao-dat-50-hat-407.html,/asset/upload/image/thu-lu-nam-my.jpg?v=20190410,New,"In Stock","40,000 VND",,
406,"Hạt Giống Sương Sâm Lông Rừng - 30 Hạt","Hạt Giống Sương Sâm Lông Rừng - 30 Hạt",https://hatgionglamson.com/san-pham/hat-giong-suong-sam-long-rung-30-hat-406.html,/asset/upload/image/hat-giong-la-cay-suong-sam-long-rung.jpg?v=20190410,New,"In Stock","35,000 VND",,
405,"Hạt Giống Măng Tây Chịu Nhiệt Năng Suất Cao - 20 Hạt","Hạt Giống Măng Tây Chịu Nhiệt Năng Suất Cao - 20 Hạt",https://hatgionglamson.com/san-pham/hat-giong-mang-tay-chiu-nhiet-nang-suat-cao-20-hat-405.html,/asset/upload/image/mang-tay-chiu-nhiet-nang-xuat-cao.jpg?v=20190410,New,"In Stock","35,000 VND",,
404,"Hạt Giống Sung Mỹ - 5 Hạt","Hạt Giống Sung Mỹ - 5 Hạt",https://hatgionglamson.com/san-pham/hat-giong-sung-my-5-hat-404.html,/asset/upload/image/hat-giong-sung-my.jpg?v=20190410,New,"In Stock","35,000 VND",,
403,"Hạt Giống Cà Chua Chuỗi Ngọc - 10 Hạt","Hạt Giống Cà Chua Chuỗi Ngọc - 10 Hạt",https://hatgionglamson.com/san-pham/hat-giong-ca-chua-chuoi-ngoc-10-hat-403.html,/asset/upload/image/ca-chua-chuoi-ngoc.jpg?v=20190410,New,"In Stock","35,000 VND",,
402,"Hạt Giống Cải KaLe Siêu Xoăn Lùn 40 cm","Hạt Giống Cải KaLe Siêu Xoăn Lùn 40 cm",https://hatgionglamson.com/san-pham/hat-giong-cai-kale-sieu-xoan-lun-40-cm-402.html,/asset/upload/image/cai-kale-sieu-xoan-lun.jpg?v=20190410,New,"In Stock","35,000 VND",,
401,"Hạt Giống Kinh Giới Tây - 200 Hạt","Hạt Giống Kinh Giới Tây - 200 Hạt",https://hatgionglamson.com/san-pham/hat-giong-kinh-gioi-tay-200-hat-401.html,/asset/upload/image/hat-giong-kinh-gioi-tay.jpg?v=20190410,New,"In Stock","35,000 VND",,
400,"Hạt Giống Xô Thơm - 20 Hạt","Hạt Giống Xô Thơm - 20 Hạt",https://hatgionglamson.com/san-pham/hat-giong-xo-thom-20-hat-400.html,/asset/upload/image/hat-giong-xo-thom.jpg?v=20190410,New,"In Stock","35,000 VND",,
399,"Hạt Giống Ngò Tây Siêu Xoăn - 2 Gram","Hạt Giống Ngò Tây Siêu Xoăn - 2 Gram",https://hatgionglamson.com/san-pham/hat-giong-ngo-tay-sieu-xoan-2-gram-399.html,/asset/upload/image/hat-giong-ngo-tay-sieu-xoan.jpg?v=20190410,New,"In Stock","35,000 VND",,
398,"Hạt Giống Gia Vị Ngò Tây Thơm- 2 Gram","Hạt Giống Gia Vị Ngò Tây Thơm- 2 Gram",https://hatgionglamson.com/san-pham/hat-giong-gia-vi-ngo-tay-thom-2-gram-398.html,/asset/upload/image/hat-giong-ngo-tay-thom.jpg?v=20190410,New,"In Stock","35,000 VND",,
397,"Hạt Giống Cà Chua Cherry Rũ Đỏ - 10 Hạt","Hạt Giống Cà Chua Cherry Rũ Đỏ - 10 Hạt",https://hatgionglamson.com/san-pham/hat-giong-ca-chua-cherry-ru-do-10-hat-397.html,/asset/upload/image/hat-giong-ca-chua-cherry-ru-do.jpg?v=20190410,New,"In Stock","35,000 VND",,
396,"Hạt Giống Rau Bạc Hà mint- 100 Hạt","Hạt Giống Rau Bạc Hà mint- 100 Hạt",https://hatgionglamson.com/san-pham/hat-giong-rau-bac-ha-mint-100-hat-396.html,/asset/upload/image/hat-giong-rau-bac-ha.jpg?v=20190410,New,"In Stock","30,000 VND",,
395,"Hạt Giống Hoa Đậu Biếc Đơn - 20 Hạt","Hạt Giống Hoa Đậu Biếc Đơn - 20 Hạt",https://hatgionglamson.com/san-pham/hat-giong-hoa-dau-biec-20-hat-395.html,/asset/upload/image/hat-giong-hoa-dau-biec_don.jpg?v=20190410,New,"In Stock","30,000 VND",,
394,"Hạt Giống Đậu Cove Vàng - 3 Gram","Hạt Giống Đậu Cove Vàng - 3 Gram",https://hatgionglamson.com/san-pham/hat-giong-dau-cove-vang-3-gram-394.html,/asset/upload/image/hat-giong-dau-cove-vang.jpg?v=20190410,New,"In Stock","30,000 VND",,
393,"Hạt Giống Dưa Chuột Chùm Siêu Trái - 5 Hạt","Hạt Giống Dưa Chuột Chùm Siêu Trái - 5 Hạt",https://hatgionglamson.com/san-pham/hat-giong-dua-chuot-chum-sieu-trai-5-hat-393.html,/asset/upload/image/dưa-chuot-chum-sieu-trai.jpg?v=20190410,New,"In Stock","30,000 VND",,
392,"Hạt Giống Hành Tây Tím - 0.3 Gram","Hạt Giống Hành Tây Tím - 0.3 Gram",https://hatgionglamson.com/san-pham/hat-giong-hanh-tay-tim-0.3-gram-392.html,/asset/upload/image/hat-giong-hanh-tay-tim.jpg?v=20190410,New,"In Stock","30,000 VND",,
391,"Hạt Giống Ớt Chuông - 40 Hạt","Hạt Giống Ớt Chuông - 40 Hạt",https://hatgionglamson.com/san-pham/hat-giong-ot-chuong-40-hat-391.html,/asset/upload/image/ot-chuong.jpg?v=20190410,New,"In Stock","30,000 VND",,
390,"Hạt Giống Ớt Ngũ Sắc - 40 Hạt","Hạt Giống Ớt Ngũ Sắc - 40 Hạt",https://hatgionglamson.com/san-pham/hat-giong-ot-ngu-sac-40-hat-390.html,/asset/upload/image/hat-giong-ot-ngu-sac.jpg?v=20190410,New,"In Stock","30,000 VND",,
389,"Hạt Giống Su Hào Tím - 0.5 Gram","Hạt Giống Su Hào Tím - 0.5 Gram",https://hatgionglamson.com/san-pham/hat-giong-su-hao-tim-0.5-gram-389.html,/asset/upload/image/hat-giong-su-hao-tim.jpg?v=20190410,New,"In Stock","30,000 VND",,
388,"Hạt Giống Súp Lơ San Hô - 0.5 Gram","Hạt Giống Súp Lơ San Hô - 0.5 Gram",https://hatgionglamson.com/san-pham/hat-giong-sup-lo-san-ho-0.5-gram-388.html,/asset/upload/image/hat-giong-sup-lo-san-ho.jpg?v=20190410,New,"In Stock","30,000 VND",,
387,"Hạt Giống Tỏi Tây ( Boa Rô) - 0.5 Gram","Hạt Giống Tỏi Tây ( Boa Rô) - 0.5 Gram",https://hatgionglamson.com/san-pham/hat-giong-toi-tay-(-boa-ro)-0.5-gram-387.html,/asset/upload/image/hat-giong-toi-tay-hanh-boaro.jpg?v=20190410,New,"In Stock","30,000 VND",,
386,"Hạt Giống Dưa Hấu Nụ - 20 Hạt","Hạt Giống Dưa Hấu Nụ - 20 Hạt",https://hatgionglamson.com/san-pham/hat-giong-dua-hau-nu-20-hat-386.html,/asset/upload/image/hat-giong-dua-hau-nu.jpg?v=20190410,New,"In Stock","30,000 VND",,
385,"Hạt Giống Mướp Rắn - 5 Hạt","Hạt Giống Mướp Rắn - 5 Hạt",https://hatgionglamson.com/san-pham/hat-giong-muop-ran-5-hat-385.html,/asset/upload/image/hat-giong-muop-ran.jpg?v=20190410,New,"In Stock","30,000 VND",,
384,"Hạt Giống Súp Lơ Trắng - 0.5 Gram","Hạt Giống Súp Lơ Trắng - 0.5 Gram",https://hatgionglamson.com/san-pham/hat-giong-sup-lo-trang-0.5-gram-384.html,/asset/upload/image/hat-giong-sup-lo-trang.jpg?v=20190410,New,"In Stock","30,000 VND",,
383,"Hạt Giống Xà Lách Búp Đăm - 2 Gram","Hạt Giống Xà Lách Búp Đăm - 2 Gram",https://hatgionglamson.com/san-pham/hat-giong-xa-lach-bup-dam-2-gram-383.html,/asset/upload/image/xa-lach-bup-mo-dam.jpg?v=20190410,New,"In Stock","30,000 VND",,
382,"Hạt Giống Xà Lách Minetto - 2 Gram","Hạt Giống Xà Lách Minetto - 2 Gram",https://hatgionglamson.com/san-pham/hat-giong-xa-lach-minetto-2-gram-382.html,/asset/upload/image/hat-giong-xa-lach-minetto.jpg?v=20190410,New,"In Stock","30,000 VND",,
381,"Hạt Giống Atiso Đỏ ( Bụp Giấm) - 50 Hạt","Hạt Giống Atiso Đỏ ( Bụp Giấm) - 50 Hạt",https://hatgionglamson.com/san-pham/hat-giong-atiso-do-(-bup-giam)-50-hat-381.html,/asset/upload/image/hat-giong-Atiso-do-Bup-Giam.jpg?v=20190410,New,"In Stock","30,000 VND",,
380,"Hạt Giống Cà Chua Bí Ngô - 20 Hạt","Hạt Giống Cà Chua Bí Ngô - 20 Hạt",https://hatgionglamson.com/san-pham/hat-giong-ca-chua-bi-ngo-20-hat-380.html,/asset/upload/image/ca-chua-bi-ngo-13.png?v=20190410,New,"In Stock","30,000 VND",,
379,"Hạt Giống Dưa Leo Gai Trắng - 10 Hạt","Hạt Giống Dưa Leo Gai Trắng - 10 Hạt",https://hatgionglamson.com/san-pham/hat-giong-dua-leo-gai-trang-10-hat-379.html,/asset/upload/image/dua-leo-gai-trang.jpg?v=20190410,New,"In Stock","30,000 VND",,
378,"Hạt Giống Dưa Chuột Mỹ Siêu Dài - 5 Hạt","Hạt Giống Dưa Chuột Mỹ Siêu Dài - 5 Hạt",https://hatgionglamson.com/san-pham/hat-giong-dua-chuot-my-sieu-dai-5-hat-378.html,/asset/upload/image/hat-giong-dua-chuot-anemina.jpg?v=20190410,New,"In Stock","30,000 VND",,
377,"Hạt Giống Bí Ngô Chuối Pinka - 5 Hạt","Hạt Giống Bí Ngô Chuối Pinka - 5 Hạt",https://hatgionglamson.com/san-pham/hat-giong-bi-ngo-chuoi-pinka-5-hat-377.html,/asset/upload/image/hat-giong-bi-ngo-chuoi-pinka.jpg?v=20190410,New,"In Stock","30,000 VND",,
376,"Hạt Giống Bí Ngô Khổng Lồ - 5 Hạt","Hạt Giống Bí Ngô Khổng Lồ - 5 Hạt",https://hatgionglamson.com/san-pham/hat-giong-bi-ngo-khong-lo-5-hat-376.html,/asset/upload/image/hat-giong-bi-ngo-khong-lo.jpg?v=20190410,New,"In Stock","30,000 VND",,
375,"Hạt Giống Cải Xoăn Kale Laci - 100 Hạt","Hạt Giống Cải Xoăn Kale Laci - 100 Hạt",https://hatgionglamson.com/san-pham/hat-giong-cai-xoan-kale-laci-100-hat-375.html,/asset/upload/image/Kale_Lacinato.jpg?v=20190410,New,"In Stock","30,000 VND",,
374,"Hạt Giống Cải Shiro Ngọt - 0.5 Gram","Hạt Giống Cải Shiro Ngọt - 0.5 Gram",https://hatgionglamson.com/san-pham/hat-giong-cai-shiro-ngot-0.5-gram-374.html,/asset/upload/image/hat-giong-cai-shiro.jpg?v=20190410,New,"In Stock","30,000 VND",,
373,"Hạt Giống Bông So Đũa Tứ Quý Thái Đỏ - 10 Hạt","Hạt Giống Bông So Đũa Tứ Quý Thái Đỏ - 10 Hạt",https://hatgionglamson.com/san-pham/hat-giong-bong-so-dua-tu-quy-thai-do-10-hat-373.html,/asset/upload/image/hat-giong-so-dua-tu-quy-thai.jpg?v=20190410,New,"In Stock","30,000 VND",,
372,"Hạt Giống Bạc Hà Âu Pepermint - 100 Hạt","Hạt Giống Bạc Hà Âu Pepermint - 100 Hạt",https://hatgionglamson.com/san-pham/hat-giong-bac-ha-au-pepermint-100-hat-372.html,/asset/upload/image/hat-giong-bac-ha-peppermint.jpg?v=20190410,New,"In Stock","30,000 VND",,
371,"Hạt Giống Cỏ Xạ Hương - 100 Hạt","Hạt Giống Cỏ Xạ Hương - 100 Hạt",https://hatgionglamson.com/san-pham/hat-giong-co-xa-huong-100-hat-371.html,/asset/upload/image/hat-giong-co-xa-huong-thyme.jpg?v=20190410,New,"In Stock","30,000 VND",,
370,"Hạt Giống Xà Lách Xoong Miền Núi - 0.5 Gram","Hạt Giống Xà Lách Xoong Miền Núi - 0.5 Gram",https://hatgionglamson.com/san-pham/hat-giong-xa-lach-xoong-mien-nui-0.5-gram-370.html,/asset/upload/image/hat-giong-xa-lach-xoong-nui.jpg?v=20190410,New,"In Stock","30,000 VND",,
369,"Hạt Giống Cải Xoăn Kale Đỏ - 100 Hạt","Hạt Giống Cải Xoăn Kale Đỏ - 100 Hạt",https://hatgionglamson.com/san-pham/hat-giong-cai-xoan-kale-do-100-hat-369.html,/asset/upload/image/hat-giong-cai-xoan-kale-do.jpg?v=20190410,New,"In Stock","30,000 VND",,
368,"Hạt Giống Súp Lơ Baby Xanh - 100 Hạt","Hạt Giống Súp Lơ Baby Xanh - 100 Hạt",https://hatgionglamson.com/san-pham/hat-giong-sup-lo-baby-xanh-100-hat-368.html,/asset/upload/image/hat-giong-sup-lo-baby.jpg?v=20190410,New,"In Stock","30,000 VND",,
367,"Hạt Giống Bắp Cải Trái Tim Chịu Nhiệt - 100 Hạt","Hạt Giống Bắp Cải Trái Tim Chịu Nhiệt - 100 Hạt",https://hatgionglamson.com/san-pham/hat-giong-bap-cai-trai-tim-chiu-nhiet-100-hat-367.html,/asset/upload/image/hat-giong-bap-cai-trai-tim-ngon-ngot.jpg?v=20190410,New,"In Stock","30,000 VND",,
366,"Hạt Giống Điên Điển - 1 Gram","Hạt Giống Điên Điển - 1 Gram",https://hatgionglamson.com/san-pham/hat-giong-dien-dien-1-gram-366.html,/asset/upload/image/hat-giong-bong-dien-dien.jpg?v=20190410,New,"In Stock","25,000 VND",,
365,"Hạt Giống Hành Tây Vàng - 0.3 Gram","Hạt Giống Hành Tây Vàng - 0.3 Gram",https://hatgionglamson.com/san-pham/hat-giong-hanh-tay-vang-0.3-gram-365.html,/asset/upload/image/hat-giong-hanh-tay-vang.jpg?v=20190410,New,"In Stock","25,000 VND",,
364,"Hạt Giống Khổ Qua Rừng - 10 Hạt","Hạt Giống Khổ Qua Rừng - 10 Hạt",https://hatgionglamson.com/san-pham/hat-giong-kho-qua-rung-10-hat-364.html,/asset/upload/image/hat-giong-kho-qua-rung.jpg?v=20190410,New,"In Stock","25,000 VND",,
363,"Hạt Giống Rau Má - 1 Gram","Hạt Giống Rau Má - 1 Gram",https://hatgionglamson.com/san-pham/hat-giong-rau-ma-1-gram-363.html,/asset/upload/image/hat-giong-cay-rau-ma-la-nho.jpg?v=20190410,New,"In Stock","25,000 VND",,
362,"Hạt Giống So Đũa - 50 Hạt","Hạt Giống So Đũa - 50 Hạt",https://hatgionglamson.com/san-pham/hat-giong-so-dua-50-hat-362.html,/asset/upload/image/hat-giong-cay-so-dua.jpg?v=20190410,New,"In Stock","25,000 VND",,
361,"Hạt Giống Trà Xanh - 15 Hạt","Hạt Giống Trà Xanh - 15 Hạt",https://hatgionglamson.com/san-pham/hat-giong-tra-xanh-15-hat-361.html,/asset/upload/image/hat-giong-tra-xanh.jpg?v=20190410,New,"In Stock","25,000 VND",,
360,"Hạt Giống Xà Lách Tím - 1 Gram","Hạt Giống Xà Lách Tím - 1 Gram",https://hatgionglamson.com/san-pham/hat-giong-xa-lach-tim-1-gram-360.html,/asset/upload/image/hat-giong-xa-lach-tim.jpg?v=20190410,New,"In Stock","25,000 VND",,
359,"Hạt Giống Xà Lách Xoong - 0.5 Gram","Hạt Giống Xà Lách Xoong - 0.5 Gram",https://hatgionglamson.com/san-pham/hat-giong-xa-lach-xoong-0.5-gram-359.html,/asset/upload/image/rau-xa-lach-xoong.jpg?v=20190410,New,"In Stock","25,000 VND",,
358,"Hạt Giống Bí Đỏ Da Xanh - 10 Hạt","Hạt Giống Bí Đỏ Da Xanh - 10 Hạt",https://hatgionglamson.com/san-pham/hat-giong-bi-do-da-xanh-10-hat-358.html,/asset/upload/image/hat-giong-bi-do-da-xanh.jpg?v=20190410,New,"In Stock","25,000 VND",,
357,"Hạt Giống Đậu Đũa Tím - 5 Gram","Hạt Giống Đậu Đũa Tím - 5 Gram",https://hatgionglamson.com/san-pham/hat-giong-dau-dua-tim-5-gram-357.html,/asset/upload/image/hat-giong-dau-dua-tim.jpg?v=20190410,New,"In Stock","25,000 VND",,
356,"Hạt Giống Rau Bồ Công Anh - 50 Hạt","Hạt Giống Rau Bồ Công Anh - 50 Hạt",https://hatgionglamson.com/san-pham/hat-giong-rau-bo-cong-anh-50-hat-356.html,/asset/upload/image/hat-giong-bo-cong-anh.jpg?v=20190410,New,"In Stock","25,000 VND",,
355,"Hạt Giống Cải Mizuna Tím - 0.5 Gram","Hạt Giống Cải Mizuna Tím - 0.5 Gram",https://hatgionglamson.com/san-pham/hat-giong-cai-mizuna-tim-0.5-gram-355.html,/asset/upload/image/cai-mizuna-tim.jpg?v=20190410,New,"In Stock","25,000 VND",,
354,"Hạt Giống Cần Tây Mĩ Khổng Lồ - 100 H","Hạt Giống Cần Tây Mĩ Khổng Lồ - 100 H",https://hatgionglamson.com/san-pham/hat-giong-can-tay-mi-khong-lo-100-h-354.html,/asset/upload/image/hat-giong-can-tay-my-khong-lo.jpg?v=20190410,New,"In Stock","25,000 VND",,
353,"Hạt Giống Cải Thìa Đỏ - 100 Hạt","Hạt Giống Cải Thìa Đỏ - 100 Hạt",https://hatgionglamson.com/san-pham/hat-giong-cai-thia-do-100-hat-353.html,/asset/upload/image/cai-thia-do.jpg?v=20190410,New,"In Stock","25,000 VND",,
352,"Hạt Giống Đậu Đũa Bụi - 20 Gram","Hạt Giống Đậu Đũa Bụi - 20 Gram",https://hatgionglamson.com/san-pham/hat-giong-dau-dua-bui-20-gram-352.html,/asset/upload/image/hat-giong-dau-dua-bui.jpg?v=20190410,New,"In Stock","25,000 VND",,
351,"Hạt Giống Bắp Cải Trái Tim Ngon Ngọt - 100 Hạt","Hạt Giống Bắp Cải Trái Tim Ngon Ngọt - 100 Hạt",https://hatgionglamson.com/san-pham/hat-giong-bap-cai-trai-tim-ngon-ngot-100-hat-351.html,/asset/upload/image/Bap-cao-trai-tim.jpg?v=20190410,New,"In Stock","25,000 VND",,
350,"Hạt Giống Dưa Leo Không Hạt Trái Ngắn - 15 Hạt","Hạt Giống Dưa Leo Không Hạt Trái Ngắn - 15 Hạt",https://hatgionglamson.com/san-pham/hat-giong-dua-leo-khong-hat-trai-ngan-15-hat-350.html,/asset/upload/image/dua-leo-khong-hat-trai-ngan.jpg?v=20190410,New,"In Stock","25,000 VND",,
349,"Hạt Giống Đậu Hà Lan Bụi Lùn - 10 Gram","Hạt Giống Đậu Hà Lan Bụi Lùn - 10 Gram",https://hatgionglamson.com/san-pham/hat-giong-dau-ha-lan-bui-lun-10-gram-349.html,/asset/upload/image/dau-ha-lan-bui-lun.jpg?v=20190410,New,"In Stock","25,000 VND",,
348,"Hạt Giống Rau Ngải Cứu - 50 Hạt","Hạt Giống Rau Ngải Cứu - 50 Hạt",https://hatgionglamson.com/san-pham/hat-giong-rau-ngai-cuu-50-hat-348.html,/asset/upload/image/hat-giong-rau-ngai-cuu.jpg?v=20190410,New,"In Stock","25,000 VND",,
347,"Hạt Giống Sả Chanh - 10 Hạt","Hạt Giống Sả Chanh - 10 Hạt",https://hatgionglamson.com/san-pham/hat-giong-sa-chanh-10-hat-347.html,/asset/upload/image/hat-giong-sa-chanh.jpg?v=20190410,New,"In Stock","25,000 VND",,
346,"Hạt Giống Bầu Tròn - 5 Hạt","Hạt Giống Bầu Tròn - 5 Hạt",https://hatgionglamson.com/san-pham/hat-giong-bau-tron-5-hat-346.html,/asset/upload/image/bau-tron.jpg?v=20190410,New,"In Stock","25,000 VND",,
345,"Hạt Giống Xà Lách Sồi Xanh - 2 Gram","Hạt Giống Xà Lách Sồi Xanh - 2 Gram",https://hatgionglamson.com/san-pham/hat-giong-xa-lach-soi-xanh-2-gram-345.html,/asset/upload/image/hat-giong-xa-lach-soi-xanh.jpg?v=20190410,New,"In Stock","25,000 VND",,
344,"Hạt Giống Xà Lách Cánh Lửa","Hạt Giống Xà Lách Cánh Lửa",https://hatgionglamson.com/san-pham/hat-giong-xa-lach-canh-lua-344.html,/asset/upload/image/hat-giong-xa-lach-canh-lua.jpg?v=20190410,New,"In Stock","25,000 VND",,
343,"Hạt Giống Xà Lách Đỏ Romaine","Hạt Giống Xà Lách Đỏ Romaine",https://hatgionglamson.com/san-pham/hat-giong-xa-lach-do-romaine-343.html,/asset/upload/image/hat-giong-xa-lach-do-romaine.jpg?v=20190410,New,"In Stock","25,000 VND",,
342,"Hạt Giống Xà Lách Ruby Đỏ - 1 Gram","Hạt Giống Xà Lách Ruby Đỏ - 1 Gram",https://hatgionglamson.com/san-pham/hat-giong-xa-lach-ruby-do-1-gram-342.html,/asset/upload/image/hat-giong-xa-lach-do-xoan-chiu-nhiet-ruby.jpg?v=20190410,New,"In Stock","25,000 VND",,
341,"Hạt Giống Cà Pháo Trứng - 40 Hạt","Hạt Giống Cà Pháo Trứng - 40 Hạt",https://hatgionglamson.com/san-pham/hat-giong-ca-phao-trung-40-hat-341.html,/asset/upload/image/hat-giong-ca-phao-trung.jpg?v=20190410,New,"In Stock","25,000 VND",,
340,"Hạt Giống Atiso Xanh - 10 Hạt","Hạt Giống Atiso Xanh - 10 Hạt",https://hatgionglamson.com/san-pham/hat-giong-atiso-xanh-10-hat-340.html,/asset/upload/image/HAT-GIONG-ATISO-xanh.jpg?v=20190410,New,"In Stock","20,000 VND",,
339,"Hạt Giống Atiso Tím - 10 Hạt","Hạt Giống Atiso Tím - 10 Hạt",https://hatgionglamson.com/san-pham/hat-giong-atiso-tim-10-hat-339.html,/asset/upload/image/hat-giong-atiso-tim-12.jpg?v=20190410,New,"In Stock","20,000 VND",,
338,"Hạt Giống Dưa Leo","Hạt Giống Dưa Leo",https://hatgionglamson.com/san-pham/hat-giong-dua-leo-338.html,/asset/upload/image/Dua-leo.jpg?v=20190410,New,"In Stock","20,000 VND",,
337,"Hạt Giống Hẹ","Hạt Giống Hẹ",https://hatgionglamson.com/san-pham/hat-giong-he-337.html,/asset/upload/image/cay-he.jpg?v=20190410,New,"In Stock","20,000 VND",,
336,"Hạt Giống Khổ Qua Gai Xanh","Hạt Giống Khổ Qua Gai Xanh",https://hatgionglamson.com/san-pham/hat-giong-kho-qua-gai-xanh-336.html,/asset/upload/image/hat-giong-kho-qua-gai-xanh-1.jpg?v=20190410,New,"In Stock","20,000 VND",,
335,"Hạt Giống Khổ Qua F1","Hạt Giống Khổ Qua F1",https://hatgionglamson.com/san-pham/hat-giong-kho-qua-f1-335.html,/asset/upload/image/hat-giong-kho-qua.jpg?v=20190410,New,"In Stock","20,000 VND",,
334,"Hạt Giống Rau Mồng Tơi","Hạt Giống Rau Mồng Tơi",https://hatgionglamson.com/san-pham/hat-giong-rau-mong-toi-334.html,/asset/upload/image/hat-giong-rau-mong-toi.jpg?v=20190410,New,"In Stock","20,000 VND",,
333,"Hạt Giống Mướp Khía","Hạt Giống Mướp Khía",https://hatgionglamson.com/san-pham/hat-giong-muop-khia-333.html,/asset/upload/image/muopkhia1.jpg?v=20190410,New,"In Stock","20,000 VND",,
332,"Hạt Giống Ngò Gai","Hạt Giống Ngò Gai",https://hatgionglamson.com/san-pham/hat-giong-ngo-gai-332.html,/asset/upload/image/Hat-giong-rau-ngo-gai.jpg?v=20190410,New,"In Stock","20,000 VND",,
331,"Hạt Giống Ớt Hiểm","Hạt Giống Ớt Hiểm",https://hatgionglamson.com/san-pham/hat-giong-ot-hiem-331.html,/asset/upload/image/ot-hiem.jpg?v=20190410,New,"In Stock","20,000 VND",,
330,"Hạt Giống Ớt Xiêm","Hạt Giống Ớt Xiêm",https://hatgionglamson.com/san-pham/hat-giong-ot-xiem-330.html,/asset/upload/image/ot-xiem.jpg?v=20190410,New,"In Stock","20,000 VND",,
329,"Hạt giống Rau Dền","Hạt giống Rau Dền",https://hatgionglamson.com/san-pham/hat-giong-rau-den-329.html,/asset/upload/image/hat-giong-rau-den.jpg?v=20190410,New,"In Stock","20,000 VND",,
328,"Hạt Giống Rau Đay Đỏ","Hạt Giống Rau Đay Đỏ",https://hatgionglamson.com/san-pham/hat-giong-rau-day-do-328.html,/asset/upload/image/hat-giong-rau-day.jpg?v=20190410,New,"In Stock","20,000 VND",,
327,"Hạt Giống Xà Lách Xoăn","Hạt Giống Xà Lách Xoăn",https://hatgionglamson.com/san-pham/hat-giong-xa-lach-xoan-327.html,,New,"In Stock","20,000 VND",,
326,"Hạt Giống Bí Nụ","Hạt Giống Bí Nụ",https://hatgionglamson.com/san-pham/hat-giong-bi-nu-326.html,/asset/upload/image/hat-giong-bi-nu.jpg?v=20190410,New,"In Stock","20,000 VND",,
325,"Hạt Giống Rau Thơm Sản ( É Trắng ","Hạt Giống Rau Thơm Sản ( É Trắng ",https://hatgionglamson.com/san-pham/hat-giong-rau-thom-san-(-e-trang--325.html,/asset/upload/image/hung-trang.jpg?v=20190410,New,"In Stock","20,000 VND",,
324,"Hạt Giống Rau Dền Đỏ","Hạt Giống Rau Dền Đỏ",https://hatgionglamson.com/san-pham/hat-giong-rau-den-do-324.html,/asset/upload/image/hat-giong-rau-den1.jpg?v=20190410,New,"In Stock","20,000 VND",,
323,"Hạt giống Hành Lá","Hạt giống Hành Lá",https://hatgionglamson.com/san-pham/hat-giong-hanh-la-323.html,/asset/upload/image/hat-giong-hanh-la.jpg?v=20190410,New,"In Stock","18,000 VND",,
322,"Hạt Giống Rau Đay Xanh","Hạt Giống Rau Đay Xanh",https://hatgionglamson.com/san-pham/hat-giong-rau-day-xanh-322.html,/asset/upload/image/rau-day-xanh.jpg?v=20190410,New,"In Stock","20,000 VND",,
321,"Hạt Giống Su Hào Xanh","Hạt Giống Su Hào Xanh",https://hatgionglamson.com/san-pham/hat-giong-su-hao-xanh-321.html,/asset/upload/image/hat-giong-su-hao-xanh.jpg?v=20190410,New,"In Stock","18,000 VND",,
320,"Hạt Giống Đu Đủ Ruột Vàng Trái Dài Phuket","Hạt Giống Đu Đủ Ruột Vàng Trái Dài Phuket",https://hatgionglamson.com/san-pham/hat-giong-du-du-ruot-vang-trai-dai-phuket-320.html,/asset/upload/image/hat-giong-du-du-ruot-do-sieu-dai-phuket.jpg?v=20190410,New,"In Stock","38,000 VND",,
319,"Hạt Giống Đu Đủ Vỏ Vàng","Hạt Giống Đu Đủ Vỏ Vàng",https://hatgionglamson.com/san-pham/hat-giong-du-du-vo-vang-319.html,/asset/upload/image/hat-giong-du-du-da-vang-1.jpg?v=20190410,New,"In Stock","35,000 VND",,
318,"Hạt Giống Dưa Lê Vỏ Vàng F1","Hạt Giống Dưa Lê Vỏ Vàng F1",https://hatgionglamson.com/san-pham/hat-giong-dua-le-vo-vang-f1-318.html,/asset/upload/image/hat-giong-dua-le-vo-vang-2.jpg?v=20190410,New,"In Stock","35,000 VND",,
317,"Hạt Giống Bắp Mỹ | Bắp Ngọt","Hạt Giống Bắp Mỹ | Bắp Ngọt",https://hatgionglamson.com/san-pham/hat-giong-bap-my-|-bap-ngot-317.html,/asset/upload/image/bap-my.jpg?v=20190410,New,"In Stock","30,000 VND",,
316,"Hạt Giống Bắp Nếp F1","Hạt Giống Bắp Nếp F1",https://hatgionglamson.com/san-pham/hat-giong-bap-nep-f1-316.html,/asset/upload/image/bap-nep-f1.jpg?v=20190410,New,"In Stock","30,000 VND",,
315,"Hạt Giống Dưa Hấu Khổng Lồ Big Daddy","Hạt Giống Dưa Hấu Khổng Lồ Big Daddy",https://hatgionglamson.com/san-pham/hat-giong-dua-hau-khong-lo-big-daddy-315.html,/asset/upload/image/dua-hau-khong-lo.jpg?v=20190410,New,"In Stock","30,000 VND",,
314,"Hạt Giống Dưa Hấu Ruột Vàng","Hạt Giống Dưa Hấu Ruột Vàng",https://hatgionglamson.com/san-pham/hat-giong-dua-hau-ruot-vang-314.html,/asset/upload/image/dua-hau-ruot-vang.jpg?v=20190410,New,"In Stock","30,000 VND",,
313,"Hạt Giống Chanh Dây","Hạt Giống Chanh Dây",https://hatgionglamson.com/san-pham/hat-giong-chanh-day-313.html,/asset/upload/image/chanh-day-2.jpg?v=20190410,New,"In Stock","25,000 VND",,
312,"Hạt Giống Dưa Gang","Hạt Giống Dưa Gang",https://hatgionglamson.com/san-pham/hat-giong-dua-gang-312.html,/asset/upload/image/dua-gang.jpg?v=20190410,New,"In Stock","25,000 VND",,
311,"Hạt Giống Dưa Hấu Hắc Mĩ Nhân","Hạt Giống Dưa Hấu Hắc Mĩ Nhân",https://hatgionglamson.com/san-pham/hat-giong-dua-hau-hac-mi-nhan-311.html,/asset/upload/image/hat-giong-dua-hau-hac-my-nhan-3.jpg?v=20190410,New,"In Stock","25,000 VND",,
310,"Hạt Giống Dưa Hấu Thành Long | Dưa Mĩ","Hạt Giống Dưa Hấu Thành Long | Dưa Mĩ",https://hatgionglamson.com/san-pham/hat-giong-dua-hau-thanh-long-|-dua-mi-310.html,/asset/upload/image/hat-giong-dua-hau-thanh-long.jpg?v=20190410,New,"In Stock","25,000 VND",,
309,"Hạt Giống Dưa Lê Vỏ Vàng OP","Hạt Giống Dưa Lê Vỏ Vàng OP",https://hatgionglamson.com/san-pham/hat-giong-dua-le-vo-vang-op-309.html,/asset/upload/image/hat-giong-dua-le-vo-vang-21.jpg?v=20190410,New,"In Stock","25,000 VND",,
308,"Hạt Giống Bắp Nếp Nù OP","Hạt Giống Bắp Nếp Nù OP",https://hatgionglamson.com/san-pham/hat-giong-bap-nep-nu-op-308.html,/asset/upload/image/bap-nep-nu-op.jpg?v=20190410,New,"In Stock","25,000 VND",,
307,"Hạt Giống Bắp Ngô Tím ","Hạt Giống Bắp Ngô Tím ",https://hatgionglamson.com/san-pham/hat-giong-bap-ngo-tim--307.html,/asset/upload/image/bap-ngo-tim.jpg?v=20190410,New,"In Stock","25,000 VND",,
306,"Hạt Giống Dưa Lê Hàn Quốc","Hạt Giống Dưa Lê Hàn Quốc",https://hatgionglamson.com/san-pham/hat-giong-dua-le-han-quoc-306.html,/asset/upload/image/dualehan10.png?v=20190410,New,"In Stock","25,000 VND",,
305,"Hạt Giống Dưa Lưới Ruột Xanh","Hạt Giống Dưa Lưới Ruột Xanh",https://hatgionglamson.com/san-pham/hat-giong-dua-luoi-ruot-xanh-305.html,/asset/upload/image/dua-luoi-ruot-xanh-24.png?v=20190410,New,"In Stock","25,000 VND",,
